[
  {
    "id": "post-20250908-001",
    "title": "Seoul's Hidden Pop-up Scene: September 2025 Edition",
    "slug": "seoul-hidden-popup-september-2025",
    "category": "real-korea-now",
    "language": "en",
    "tags": [
      "seoul",
      "popup",
      "seongsu",
      "hannam",
      "shopping"
    ],
    "lastUpdatedKST": "2025-09-08T09:00:00+09:00",
    "readingTimeMin": 6,
    "seo": {
      "description": "Discover Seoul's hottest pop-up stores and exhibitions this September. Insider guide to Seongsu and Hannam pop-ups for Canadian visitors.",
      "keywords": [
        "seoul popup",
        "seongsu popup",
        "korea shopping",
        "seoul events"
      ]
    },
    "status": "Published",
    "sources": [
      {
        "title": "Seoul Pop-up Calendar",
        "url": "https://example.seoul.kr/popup",
        "publisher": "Seoul Tourism"
      },
      {
        "title": "Seongsu District Official Events",
        "url": "https://example.seongsu.kr/events",
        "publisher": "Seongsu District Office"
      }
    ],
    "adsPolicy": {
      "isSensitiveSection": false,
      "topAdDisabled": false
    },
    "body": "# Seoul's Hidden Pop-up Scene: September 2025\n\nSeoul's pop-up culture is exploding, and September 2025 is packed with incredible temporary experiences that most tourists miss...\n\n## Seongsu District Highlights\n\n### Tamburins x Gentle Monster Collaboration\n- **Location**: Seongsu-dong Street\n- **Duration**: September 1-15\n- **What to expect**: Limited edition fragrances and eyewear\n\n## Getting There\nTake Line 2 to Seongsu Station, Exit 3..."
  },
  {
    "id": "post-20250908-002",
    "title": "Korean Subway Etiquette: What Canadians Need to Know",
    "slug": "korean-subway-etiquette-canadians",
    "category": "travel-food",
    "language": "en",
    "tags": [
      "subway",
      "etiquette",
      "transportation",
      "culture",
      "tips"
    ],
    "lastUpdatedKST": "2025-09-08T10:30:00+09:00",
    "readingTimeMin": 4,
    "seo": {
      "description": "Master Korean subway etiquette with this guide for Canadians. Learn the unwritten rules of Seoul's subway system.",
      "keywords": [
        "korean subway etiquette",
        "seoul transportation",
        "korea travel tips"
      ]
    },
    "status": "Published",
    "sources": [
      {
        "title": "Seoul Metro Official Guide",
        "url": "https://example.metro.seoul.kr/guide",
        "publisher": "Seoul Metro"
      },
      {
        "title": "Korea Tourism Etiquette Guide",
        "url": "https://example.visitkorea.kr/etiquette",
        "publisher": "Korea Tourism Organization"
      }
    ],
    "adsPolicy": {
      "isSensitiveSection": false,
      "topAdDisabled": false
    },
    "body": "# Korean Subway Etiquette: A Canadian's Guide\n\nNavigating Seoul's subway system goes beyond just knowing the routes..."
  },
  {
    "id": "post-20250908-003",
    "title": "Student Visa Application: Complete Guide for Canadians",
    "slug": "student-visa-application-canadians-korea",
    "category": "travel-food",
    "language": "en",
    "tags": [
      "visa",
      "student",
      "canada",
      "application",
      "documents"
    ],
    "lastUpdatedKST": "2025-09-08T11:00:00+09:00",
    "readingTimeMin": 8,
    "seo": {
      "description": "Complete student visa application guide for Canadians studying in Korea. Required documents, timeline, and step-by-step process.",
      "keywords": [
        "korean student visa canada",
        "visa application korea",
        "study abroad korea"
      ]
    },
    "status": "Published",
    "sources": [
      {
        "title": "Korean Embassy in Canada - Visa Services",
        "url": "https://example.embassy.kr/visa",
        "publisher": "Korean Embassy Canada"
      },
      {
        "title": "Korea Immigration Service",
        "url": "https://example.immigration.go.kr/student",
        "publisher": "Korea Immigration Service"
      }
    ],
    "adsPolicy": {
      "isSensitiveSection": true,
      "topAdDisabled": true
    },
    "body": "# Student Visa Application Guide for Canadians\n\nApplying for a Korean student visa from Canada requires careful preparation..."
  },
  {
    "id": "post-20250908-004",
    "title": "Essential Korean Phrases for Canadian Travelers",
    "slug": "essential-korean-phrases-canadian-travelers",
    "category": "learn-korean",
    "language": "en",
    "tags": [
      "phrases",
      "travel",
      "basic-korean",
      "communication"
    ],
    "lastUpdatedKST": "2025-09-08T12:00:00+09:00",
    "readingTimeMin": 5,
    "seo": {
      "description": "Learn essential Korean phrases for travel. Practical expressions for Canadian visitors to Korea with pronunciation guides.",
      "keywords": [
        "korean phrases travel",
        "basic korean canada",
        "korean language travel"
      ]
    },
    "status": "Published",
    "sources": [
      {
        "title": "Talk To Me In Korean - Travel Phrases",
        "url": "https://talktomeinkorean.com/travel",
        "publisher": "TTMIK"
      },
      {
        "title": "KTO Language Guide",
        "url": "https://example.visitkorea.kr/language",
        "publisher": "Korea Tourism Organization"
      }
    ],
    "adsPolicy": {
      "isSensitiveSection": false,
      "topAdDisabled": false
    },
    "body": "# Essential Korean Phrases for Canadian Travelers\n\nBefore your trip to Korea, learn these essential phrases..."
  },
  {
    "id": "post-20250908-005",
    "title": "BTS Military Service Updates: What Canadian Fans Should Know",
    "slug": "bts-military-service-updates-canadian-fans",
    "category": "k-pop",
    "language": "en",
    "tags": [
      "bts",
      "military-service",
      "kpop",
      "updates",
      "fans"
    ],
    "lastUpdatedKST": "2025-09-08T13:00:00+09:00",
    "readingTimeMin": 7,
    "seo": {
      "description": "Latest updates on BTS military service and group activities. Timeline, individual projects, and what Canadian fans can expect.",
      "keywords": [
        "bts military service",
        "bts updates 2025",
        "kpop news canada"
      ]
    },
    "status": "Published",
    "sources": [
      {
        "title": "HYBE Official Statement",
        "url": "https://example.hybecorp.com/news",
        "publisher": "HYBE Corporation"
      },
      {
        "title": "Soompi K-pop News",
        "url": "https://soompi.com/bts-military",
        "publisher": "Soompi"
      }
    ],
    "adsPolicy": {
      "isSensitiveSection": false,
      "topAdDisabled": false
    },
    "body": "# BTS Military Service: Updates for Canadian Fans\n\nAs BTS members fulfill their mandatory military service..."
  }
]